title,prep_time,cook_time,total_time,ingredients,ingredients with measurement,instructions,calories,servings,images
Creamy French Onion and Mushroom Soup.,{'minutes': '15'},{'minutes': '45'},{'hours': '1'},"['salted butter', 'medium yellow onions, thinly sliced', 'dry white wine, such as Pinot Grigio or Sauvignon Blanc', 'garlic minced or grated', 'cremini or wild mushrooms, sliced', 'fresh thyme leaves', 'chopped fresh sage', 'honey', 'low sodium chicken or vegetable broth', 'Worcestershire sauce', 'bay leaves', 'kosher salt and black pepper', 'heavy cream', 'french bread', 'shredded Gruyère cheese']","{'salted butter': '6', 'medium yellow onions, thinly sliced': '4', 'dry white wine, such as Pinot Grigio or Sauvignon Blanc': '1 1/4', 'garlic minced or grated': '3', 'cremini or wild mushrooms, sliced': '2', 'fresh thyme leaves': '2', 'chopped fresh sage': '2', 'honey': '1', 'low sodium chicken or vegetable broth': '6-8', 'Worcestershire sauce': '2', 'bay leaves': '2', 'kosher salt and black pepper': 'seasoning', 'heavy cream': '1/2', 'french bread': '6', 'shredded Gruyère cheese': '2'}","[""1. Melt together the butter, onions, and honey in a large Dutch oven over medium-high heat. Cook, stirring occasionally until softened, about 10 minutes. At this point, you want to slowly add 3/4 cup of the wine, 1/4 cup at a time, until the wine cooks into the onions. Continue to cook another 10-15 minutes until you've used the 3/4 cup of wine and the onions are deeply caramelized."", '2. Add the garlic, mushrooms, thyme, and sage. Season with salt and pepper, cook another 3-4 minutes. Add the remaining 1/2 cup wine, the broth, Worcestershire sauce, bay leaves, and a pinch each of salt and pepper. Increase the heat to medium-high and return the soup to a simmer, simmer 10 minutes, then stir in the cream and cook another 5-10 minutes. Remove the bay leaves and discard. Season to taste with salt and pepper.', '3. Meanwhile, preheat the oven to 400 degrees F. Arrange the bread on a baking sheet and toast for 10-15 minutes, until very dry. Switch the oven to broil.', '4. Ladle the soup into oven safe bowls. Add a slice of bread to each, and top evenly with cheese. Place each soup bowl on a baking sheet and transfer to the oven, broil until bubbly and golden brown, 3 to 5 minutes. Top with fresh thyme. Eat!']",630 kcal,6,https://www.halfbakedharvest.com/wp-content/uploads/2020/10/Creamy-French-Onion-and-Mushroom-Soup-1-700x1050.jpg
Baked Buffalo Chicken Egg Rolls with Cilantro Lime Ranch,{'minutes': '20'},{'minutes': '25'},{'minutes': '45'},"['cooked shredded chicken', 'plain greek yogurt', 'buffalo sauce', 'chopped fresh chives', 'dried parsley', 'dried dill', 'onion powder', 'garlic powder', 'kosher salt', 'shredded cheddar cheese', 'crumbled blue cheese', 'square egg roll wrappers', 'sour cream or plain Greek yogurt', 'fresh cilantro, finely chopped', 'chopped fresh chives', 'garlic powder', 'onion powder', 'juice from 2 limes']","{'cooked shredded chicken': '1 1/2', 'plain greek yogurt': '1/3', 'buffalo sauce': '1/2', 'chopped fresh chives': '1', 'dried parsley': '2', 'dried dill': '2', 'onion powder': '1', 'garlic powder': '1', 'kosher salt': 'seasoning', 'shredded cheddar cheese': '1', 'crumbled blue cheese': '1/4', 'square egg roll wrappers': '20-22', 'sour cream or plain Greek yogurt': '1', 'fresh cilantro, finely chopped': '3/4', 'juice from 2 limes': 'seasoning'}","['1. Preheat the oven to 425 degrees F. Lightly grease 2 baking sheets.', '2. In a bowl, combine the chicken, yogurt, buffalo sauce, chives, parsley, dill, onion powder, garlic powder, and a pinch of salt. Stir in the cheeses.', '3. \xa0To assemble, spoon 2 tablespoons of filling onto each wrapper. Brush water around the edges of the wrapper, then roll up and place on the baking sheet. Brush each roll lightly with olive oil. Transfer to the oven and bake for 10-12 minutes, then flip and cook another 8-10 minutes more, or until the rolls are crisp.', '4. Meanwhile, make the ranch. Combine all ingredients in a glass jar and shake or stir until creamy.', '5. Serve the egg rolls with fresh herbs and plenty of ranch for dipping.']",333 kcal,8,https://www.halfbakedharvest.com/wp-content/uploads/2020/08/Baked-Buffalo-Chicken-Egg-Rolls-with-Cilantro-Lime-Ranch-1-700x1050.jpg
Oven Fried Coconut Shrimp with Thai Pineapple Chili Sauce,{'minutes': '20'},{'minutes': '10'},{'minutes': '30'},"['eggs, beaten', 'large shrimp, tail on, peeled and deveined', 'shredded unsweetened coconut', 'Panko breadcrumbs', 'all purpose flour', 'raw sesame seeds', 'paprika', 'kosher salt and black pepper', 'extra virgin olive oil', 'sweet Thai chili sauce', 'ketchup', 'garlic, grated', 'finely chopped pineapple', 'zest and juice from 1 lime, plus more for serving', 'Thai basil or cilantro, for serving', 'honey mustard or aioli, for serving']","{'eggs, beaten': '2', 'large shrimp, tail on, peeled and deveined': '2', 'shredded unsweetened coconut': '1 1/2', 'Panko breadcrumbs': '1/2', 'all purpose flour': '2', 'raw sesame seeds': '2', 'paprika': '1/2', 'kosher salt and black pepper': 'seasoning', 'extra virgin olive oil': 'seasoning', 'sweet Thai chili sauce': '1/2', 'ketchup': '2', 'garlic, grated': '1-2', 'finely chopped pineapple': '1/2', 'zest and juice from 1 lime, plus more for serving': 'seasoning', 'Thai basil or cilantro, for serving': 'seasoning', 'honey mustard or aioli, for serving': 'seasoning'}","['1. In a bowl, whisk together the eggs. Add the shrimp and toss well to coat.', '2. Preheat the oven to 425 degrees F. Rub 2 baking sheets with oil.', '3. To a medium-sized bowl, add the coconut, Panko, flour, sesame seeds, paprika, and a pinch each of salt and pepper. Stir to combine.', '4. Remove each shrimp from the egg, and dredge through the crumbs, pressing gently to adhere. Place on the prepared baking sheet. Repeat until all the shrimp have been used. Make sure not to crowd your pan, if necessary use two baking sheets. Lightly brush/drizzle the shrimp with olive oil. Transfer to the oven and bake for 8-12 minutes, until the shrimp is cooked and the breading crisp.', '5. Meanwhile, make the chili sauce by combining all the ingredients in a bowl.', '6. Serve the shrimp topped with Thai basil, limes, and the pineapple chili sauce for dipping. Add creamy honey mustard or aioli for a little double-dip action. Enjoy!']",557 kcal,6,https://www.halfbakedharvest.com/wp-content/uploads/2020/08/Oven-Fried-Coconut-Shrimp-with-Thai-Pineapple-Chili-Sauce-1-700x1050.jpg
One Pot 4 Cheese Caprese Mac and Cheese,{'minutes': '20'},{'minutes': '40'},{'hours': '1'},"['salted butter', 'garlic, grated', 'crushed Ritz crackers', 'your favorite short cut pasta', 'cream cheese, cubed', 'milk', 'sharp white cheddar cheese', 'shredded Havarti or fontina cheese', 'Brie, rind removed and chopped', 'basil pesto, homemade or store-bought', 'mustard powder', 'cayenne pepper', 'kosher salt and black pepper', 'cherry tomatoes, halved', 'mozzarella cheese', 'regular or heirloom tomatoes, sliced', 'fresh basil, for serving']","{'salted butter': '6', 'garlic, grated': '1-2', 'crushed Ritz crackers': '1', 'your favorite short cut pasta': '1', 'cream cheese, cubed': '2', 'milk': '2', 'sharp white cheddar cheese': '1', 'shredded Havarti or fontina cheese': '1', 'Brie, rind removed and chopped': '4-6', 'basil pesto, homemade or store-bought': '1/4', 'mustard powder': '1/4', 'cayenne pepper': '1/4', 'kosher salt and black pepper': 'seasoning', 'cherry tomatoes, halved': '1', 'mozzarella cheese': '1', 'regular or heirloom tomatoes, sliced': '1-2', 'fresh basil, for serving': 'seasoning'}","['1. Preheat the oven to 375°F. Grease a 9×13-inch baking dish.', '2. In a large pot, bring 4 cups of water to a boil over high heat. Add 1 teaspoon salt and the pasta. Cook, stirring occasionally, for 8 minutes. Do not drain the water. Stir in the milk, cream cheese, mustard, cayenne, and a pinch each of salt and pepper. Cook until the cream cheese has melted and the pasta is al dente, about 4-5 minutes.', '2.\xa0Add the cheddar, Havarti, brie, and 3 tablespoons butter. Stir until melted and creamy. Remove from the heat. Stir in the pesto and cherry tomatoes.', '3. Transfer the mixture to the prepared baking dish. Top with the mozzarella. Lay on the tomato slices. Season with salt and pepper.', '4. In a medium bowl, stir together the crackers, the remaining 3 tablespoons of butter, and the garlic. Sprinkle the crumbs evenly over the mac and cheese. Bake until the sauce is bubbling and the crumbs are golden, about 20 minutes. Eat and enjoy!']",515 kcal,8,https://www.halfbakedharvest.com/wp-content/uploads/2020/08/5X9A3911-700x1050.jpg
Cheesy Zucchini Chicken and Rice Bake,{'minutes': '15'},{'minutes': '40'},{'minutes': '55'},"['extra virgin olive oil', 'small/medium zucchini, chopped', 'kosher salt and black pepper', 'yellow onion, chopped', 'boneless chicken breasts, cut into cubes', 'salted butter', 'garlic, minced or grated', 'basmati or jasmine rice', 'dry orzo pasta', 'fresh thyme leaves', 'low sodium chicken broth', 'cayenne pepper', 'shredded Havarti cheese', 'shredded sharp cheddar cheese', 'everything bagel spice', 'chopped fresh chives', 'fresh basil, for serving']","{'extra virgin olive oil': '2', 'small/medium zucchini, chopped': '3', 'kosher salt and black pepper': 'seasoning', 'yellow onion, chopped': '1', 'boneless chicken breasts, cut into cubes': '1', 'salted butter': '2', 'garlic, minced or grated': '2', 'basmati or jasmine rice': '1 1/2', 'dry orzo pasta': '1/2', 'fresh thyme leaves': '2', 'low sodium chicken broth': '3', 'cayenne pepper': '1/2', 'shredded Havarti cheese': '3/4', 'shredded sharp cheddar cheese': '3/4', 'everything bagel spice': '2-4', 'chopped fresh chives': '1', 'fresh basil, for serving': 'seasoning'}","['1. Preheat the oven to 425 degrees F.', '2. Heat 1 tablespoon olive oil in a large pot over medium heat. When the oil shimmers, add the zucchini and season with salt and pepper. Cook until the zucchini is golden, 5-8 minutes. Remove the zucchini from the skillet and set aside.', '3. To the skillet, add the remaining oil and the onion. Cook until fragrant, about 5 minutes. Stir in the chicken and season with salt and pepper. Cook until the chicken is seared, 2-3 minutes. Add the butter, garlic, rice, orzo, and thyme, and cook until golden and toasted, 2-3 minutes. Add the broth and bring to a boil over high heat. Add the zucchini back to the skillet. Add the cayenne and a large pinch each of salt and pepper. Bring to a boil, cover, and reduce heat to low. Cook, covered for 15-20 minutes, until the rice is mostly cooked.', '4. Once the rice is cooked, stir in 1/2 cup of the Havarti and 1/2 cup of the cheddar. If needed, transfer the rice to an oven-safe casserole dish. Scatter the remaining 1/4 cup of each cheese overtop the casserole.\xa0Sprinkle on the everything spice and chives.', '5. Transfer to the oven and bake 10-15 minutes, until the cheese is melted. Switch the oven to broil and broil 1-2 minutes, until the cheese on top is becoming crispy. Serve warm with fresh basil.']",763 kcal,6,https://www.halfbakedharvest.com/wp-content/uploads/2020/08/Cheesy-Zucchini-Chicken-and-Rice-Bake-1-700x1050.jpg
Prosciutto Balsamic Peach Chicken with Burrata and Basil.,{'minutes': '15'},{'minutes': '15'},{'minutes': '30'},"['chicken cutlets or 2 boneless chicken breasts, sliced in half horizontally', 'kosher salt and black pepper', 'fig preserves/jam', 'thin slices prosciutto', 'small shallots, halved', 'garlic cloves, smashed', 'peaches, cut into 10-12 wedges', 'fresh thyme leaves', 'extra virgin olive oil', 'salted butter', 'crushed red pepper flakes', 'balsamic vinegar', 'dry white wine, such as Pinot Grigio or Sauvignon Blanc', 'burrata cheese, at room temperature', 'fresh basil']","{'chicken cutlets or 2 boneless chicken breasts, sliced in half horizontally': '4', 'kosher salt and black pepper': 'seasoning', 'fig preserves/jam': '4', 'thin slices prosciutto': '8', 'small shallots, halved': '2', 'garlic cloves, smashed': '4', 'peaches, cut into 10-12 wedges': '2', 'fresh thyme leaves': '2', 'extra virgin olive oil': '2', 'salted butter': '1', 'crushed red pepper flakes': '1', 'balsamic vinegar': '1/2', 'dry white wine, such as Pinot Grigio or Sauvignon Blanc': '1/4', 'burrata cheese, at room temperature': '2', 'fresh basil': '1/2'}","['1. Preheat the oven to 425 degrees F. Grease an oven-safe skillet with olive oil.', '2. Season the chicken with salt and pepper. Spread each cutlet with 1 tsp fig preserves, then wrap 2 pieces of prosciutto around each cutlet. Transfer the chicken to the prepared skillet. Arrange the shallots, peaches, and thyme around the chicken. Drizzle olive oil over the peaches, season with salt and pepper. Transfer to the oven and roast for 15-20 minutes, until the chicken is cooked.', '3. Switch the oven to broil Remove the peaches from the skillet to a plate. Return the chicken to the oven and broil for 1-2 minutes, until the prosciutto is crisp.\xa0WATCH CLOSELY.\xa0Remove from the oven, place the chicken on the plate with the peaches.', '4. Place the skillet with the shallots and garlic over medium heat. Add the butter and a pinch of red pepper flakes. Add the balsamic vinegar and wine. Bring to a boil over high heat. Boil 3-5 minutes, until reduced by half. Slide the chicken and peaches back into the skillet, simmer 1 minute. Remove from the heat.', '5. Serve the chicken topped with peaches, burrata, and fresh basil. Drizzle over any remaining pan sauce. Serve alongside orzo and crusty bread for soaking up that sauce. Enjoy!']",676 kcal,4,https://www.halfbakedharvest.com/wp-content/uploads/2020/08/Prosciutto-Balsamic-Peach-Chicken-with-Burrata-and-Basil-1-700x1050.jpg
Cherry Tomato Pesto Polenta with Fried Halloumi,{'minutes': '10'},{'minutes': '15'},{'minutes': '25'},"['dry quick-cooking polenta', 'salted butter', 'fresh grated parmesan cheese', 'basil pesto, homemade or store-bought', 'kosher salt and black pepper', 'extra virgin olive oil', 'halloumi cheese, sliced into 1/4 inch pieces', 'cherry tomatoes', 'garlic, smashed', 'shallot, thinly sliced', 'mixed fresh herbs, such as oregano, thyme, and dill', 'crushed red pepper flakes', 'balsamic vinegar', 'fresh basil, roughly chopped', 'fresh chopped chives, for serving']","{'dry quick-cooking polenta': '1 1/2', 'salted butter': '3', 'fresh grated parmesan cheese': '1/4', 'basil pesto, homemade or store-bought': '1/4', 'kosher salt and black pepper': 'seasoning', 'extra virgin olive oil': '4', 'halloumi cheese, sliced into 1/4 inch pieces': '8', 'cherry tomatoes': '4', 'garlic, smashed': '4', 'shallot, thinly sliced': '1', 'mixed fresh herbs, such as oregano, thyme, and dill': '1/2', 'crushed red pepper flakes': '1', 'balsamic vinegar': '3', 'fresh basil, roughly chopped': '1/4', 'fresh chopped chives, for serving': 'seasoning'}","['1. To make the polenta. In a medium saucepan, bring 4 cups water to a boil. Slowly whisk in the polenta, stirring until the polenta is soft and thick, about 3-5 minutes. Stir in the butter, parmesan, the pesto, and season with salt and pepper. Turn the heat off, cover the pot, and let the polenta sit 5 minutes.', '4. Meanwhile, cook the halloumi. Heat 1 tablespoon olive oil in a large skillet over medium heat. When the oil shimmers, add the halloumi and cook until golden, about 3 minutes per side. Remove from skillet.', '3. To the same skillet, add the remaining 3 tablespoons oil. When the oil shimmers, add the tomatoes, garlic, shallot, herbs, and a pinch each of salt, pepper, and red pepper flakes. Cook until the tomatoes begin to pop, about 4-5 minutes. Remove from the heat and add the balsamic vinegar and basil.', '4. Divide the polenta between bowls. Spoon the tomatoes over top, then add the Halloumi. Drizzle with additional pesto and top with fresh basil and chives. Enjoy!']",392 kcal,6,https://www.halfbakedharvest.com/wp-content/uploads/2020/08/Cherry-Tomato-Pesto-Polenta-with-Fried-Halloumi-2-700x1050.jpg
Crispy Sesame Ginger Potstickers with Chive Chili Sauce,{'minutes': '25'},{'minutes': '20'},{'minutes': '45'},"['sesame oil', 'shallots, chopped', 'medium zucchini chopped', 'chopped kale, spinach, or bok choy', 'fresh ginger, grated', 'garlic, minced or grated', 'low sodium soy sauce or tamari', 'black pepper', 'round dumpling or wonton wrappers', 'raw sesame seeds', 'toasted sesame oil', 'chili garlic sauce', 'low sodium soy sauce or tamari', 'honey', 'red pepper flakes', 'finely chopped fresh chives', 'roasted peanuts', 'creamy garlic special sauce, for serving']","{'sesame oil': '2', 'shallots, chopped': '2', 'medium zucchini chopped': '3', 'chopped kale, spinach, or bok choy': '2', 'fresh ginger, grated': '1', 'garlic, minced or grated': '4', 'low sodium soy sauce or tamari': '2', 'black pepper': 'seasoning', 'round dumpling or wonton wrappers': '20-22', 'raw sesame seeds': '1/3', 'toasted sesame oil': '1/4', 'chili garlic sauce': '2', 'honey': '2', 'red pepper flakes': '1-2', 'finely chopped fresh chives': '1/4', 'roasted peanuts': '1/4', 'creamy garlic special sauce, for serving': 'seasoning'}","['1. Heat the sesame oil in a large skillet over medium-high heat. When the oil shimmers, add the shallots and cook until fragrant and lightly caramelized, 2 minutes. Add the zucchini, kale, ginger, and garlic, and cook, stirring occasionally until the zucchini has cooked down, about 5 minutes. Add the soy sauce and a large pinch of pepper. Cook another 2-3 minutes, until the vegetables have soaked up the so sauce. Remove from the heat and let cool.', '2. To assemble, spoon 1 tablespoon of filling onto each wrapper. Brush water around the edges of the wrapper.\xa0Fold the edges of the wrapper up around the filling and pinch in the edges to seal.\xa0Repeat with the remaining wrappers.', '3. Place the sesame seeds in a shallow bowl.  Bring a large pot of water to a boil. Boil the potsticker for 1-2 minutes, until they float. Drain and then dredge in the sesame seeds.', '4. Heat a few tablespoons of oil in a large skillet set over medium heat. When the oil shimmers, add the dumplings and cook until the bottoms are light golden brown, about 2-3 minutes. Once crispy, remove from the pan. Serve warm with the sauces.', '5. To make the sauce, combine all ingredients in a medium bowl. Serve alongside the dumplings.']",570 kcal,20,https://www.halfbakedharvest.com/wp-content/uploads/2020/08/Crispy-Sesame-Ginger-Potstickers-with-Chive-Chili-Sauce-1-700x1050.jpg
15 Minute Garlic Butter Ramen Noodles.,{'minutes': '5'},{'minutes': '10'},{'minutes': '15'},"['brown rice ramen noodles', 'salted butter', 'garlic, minced or grated', 'fresh grated ginger', 'small or 1 medium zucchini, grated', 'low sodium soy sauce', 'fresh basil, roughly chopped', 'soft boiled or fried eggs', 'toasted sesame seeds']","{'brown rice ramen noodles': '2-3', 'salted butter': '6', 'garlic, minced or grated': '4', 'fresh grated ginger': '2', 'small or 1 medium zucchini, grated': '2', 'low sodium soy sauce': '1/4', 'fresh basil, roughly chopped': '1/2', 'soft boiled or fried eggs': '4', 'toasted sesame seeds': 'seasoning'}","['1. Bring a large pot of water to a boil. Cook the noodles according to package directions. Drain.', '2. Meanwhile, heat a large skillet over medium-high heat. Add the butter and garlic. Cook until the garlic is golden and caramelized, about 2-3 minutes.\xa0Stir in the ginger, cooking another minute. Stir in the zucchini, cooking another 2-3 minutes, until the zucchini wilts into the butter. Stir in the ramen noodles, soy sauce, and basil. Gently toss to combine. Remove from the heat.', '3. Divide the noodles among bowls and top with sesame seeds, basil, and eggs, if desired. Eat immediately...enjoy!']",786 kcal,4,https://www.halfbakedharvest.com/wp-content/uploads/2020/07/15-Minute-Garlic-Butter-Ramen-Noodles-1-700x1050.jpg
Browned Butter Scallops and Burst Tomato Basil Pasta,{'minutes': '15'},{'minutes': '15'},{'minutes': '30'},"['angel hair or linguine', 'large scallops, patted dry', 'kosher salt and black pepper', 'extra virgin olive oil', 'cherry tomatoes', 'garlic, smashed', 'crushed red pepper flakes', 'fresh thyme leaves', 'salted butter', 'corn, kernels removed from the cob', 'dry white wine, such as Pinot Grigio or Sauvignon Blanc', 'zest and juice of 1 lemon', 'fresh grated parmesan cheese', 'fresh basil, roughly chopped', 'ball burrata cheese, at room temperature']","{'angel hair or linguine': '3/4', 'large scallops, patted dry': '1', 'kosher salt and black pepper': 'seasoning', 'extra virgin olive oil': '4', 'cherry tomatoes': '1 1/2', 'garlic, smashed': '4', 'crushed red pepper flakes': '1', 'fresh thyme leaves': '1', 'salted butter': '4', 'corn, kernels removed from the cob': '2', 'dry white wine, such as Pinot Grigio or Sauvignon Blanc': '1/3', 'zest and juice of 1 lemon': 'seasoning', 'fresh grated parmesan cheese': '1/3', 'fresh basil, roughly chopped': '1/2', 'ball burrata cheese, at room temperature': '1'}","['1. Bring a large pot of salted water to a boil. Cook the pasta according to package directions, until al dente. Just before draining, remove 1 cup of the pasta cooking water. Drain the pasta.', '2. Meanwhile, heat 2 tablespoons of olive oil in a large skillet over medium heat. Season the scallops with salt and pepper. When the oil shimmers, add the scallops and sear on both sides until browned, about 2-3 minutes. Remove the scallops from the skillet to a plate.', '3. To the same skillet, add the tomatoes, garlic, thyme, and a pinch each of salt, pepper, and red pepper flakes. Cook until the tomatoes begin to pop, about 4-5 minutes. Add the butter and corn, cook until just browned, another 2-3 minutes. Pour in the wine and lemon juice, simmer 2-3 minutes. Add the pasta,\xa0parmesan, basil, and scallops, gently toss to combine. If needed, thin the sauce with a little of the pasta cooking water.', '5. Divide the pasta among plates and top with burrata cheese, basil, and lemon. Enjoy!']",629 kcal,6,https://www.halfbakedharvest.com/wp-content/uploads/2020/07/Browned-Butter-Scallops-and-Burst-Tomato-Basil-Pasta-1-700x1050.jpg
Roasted Tomato Cheddar Tart with Ranch Seasoning,{'minutes': '15'},{'minutes': '25'},{'minutes': '40'},"['heirloom tomatoes, sliced', 'kosher salt and black pepper', 'sheet frozen puff pastry, thawed', 'crème fraîche, plain Greek yogurt, or sour cream', 'shredded sharp cheddar cheese', 'extra virgin olive oil', 'fresh basil, for serving', 'chopped fresh parsley', 'chopped fresh chives', 'chopped fresh dill', 'garlic, grated', 'cayenne pepper', 'each kosher salt and black pepper']","{'heirloom tomatoes, sliced': '3-4', 'kosher salt and black pepper': 'seasoning', 'sheet frozen puff pastry, thawed': '1', 'crème fraîche, plain Greek yogurt, or sour cream': '2', 'shredded sharp cheddar cheese': '1 1/2', 'extra virgin olive oil': 'seasoning', 'fresh basil, for serving': 'seasoning', 'chopped fresh parsley': '1/4', 'chopped fresh chives': '1/4', 'chopped fresh dill': '1/4', 'garlic, grated': '2', 'cayenne pepper': '1/2', 'each kosher salt and black pepper': '1/2'}","['1. Preheat the oven to 425 degrees F. Line a baking sheet with parchment paper.', '2. Arrange the tomatoes on a cutting board and sprinkle with salt. Let sit 15 minutes to draw out excess moisture.', '3. Meanwhile, make the ranch seasoning. Combine all ingredients in a bowl.', '4. Lay the thawed puff pastry on the prepared baking sheet and prick all over with a fork. Spread the crème fraîche over the dough, leaving a 1/4-inch border. Top with cheddar cheese. Layer on the tomatoes, then sprinkle the ranch seasoning over each tomato. Transfer to the oven and bake for 25-30 minutes or until the pastry is golden and the cheese melted.', '5. Serve warm or at room temperature with a dollop of crème fraîche, yogurt, or sour cream, and fresh basil. Eat and enjoy!']",623 kcal,6,https://www.halfbakedharvest.com/wp-content/uploads/2020/07/Roasted-Tomato-Cheddar-Tart-with-Ranch-Seasoning-1-700x1050.jpg
