title,prep_time,cook_time,total_time,ingredients,ingredients with measurement,instructions,calories,servings,images
Spicy Tuscan Chicken Pasta,{'minutes': '20'},{'minutes': '25'},{'minutes': '45'},"['oil-packed sun-dried tomatoes', 'boneless skinless chicken breasts, cubed', 'Italian seasoning', 'paprika or smoked paprika', 'red pepper flakes', 'kosher salt and black pepper', 'grated parmesan cheese', 'salted butter', 'medium shallot, chopped', 'garlic, chopped', 'crushed Calabrian chili paste', 'short cut pasta', 'heavy cream', 'fresh baby spinach']","{'oil-packed sun-dried tomatoes': '1', 'boneless skinless chicken breasts, cubed': '1', 'Italian seasoning': '4', 'paprika or smoked paprika': '1', 'red pepper flakes': 'seasoning', 'kosher salt and black pepper': 'seasoning', 'grated parmesan cheese': '1', 'salted butter': '2', 'medium shallot, chopped': '1', 'garlic, chopped': '2', 'crushed Calabrian chili paste': '2-3', 'short cut pasta': '1', 'heavy cream': '1', 'fresh baby spinach': '2'}","['1. Drain 3 tablespoons of oil from the sun-dried tomato jar into a large pot or skillet with sides. Chop the sun-dried tomatoes and set aside.', '2. Set the pot over medium-high heat. Add the chicken, 3 teaspoons Italian seasoning, the paprika, and a pinch each of red pepper flakes, salt, and pepper. Cook until golden brown, 5 minutes. Add 1/4 cup parmesan, cook another minute, then remove the chicken from the pot.', '3. To the same pot, add a drizzle of oil and the butter. Add the shallot, garlic, Calabrian chili paste, and 1 teaspoon of Italian seasoning. Cook until fragrant, about 3 minutes. Add 3 1/2 cups water. Bring to a boil, add the pasta, and cook, stirring often, until the pasta is al dente, 8 minutes. Stir in the cream, spinach, chopped sun-dried tomatoes, and remaining 3/4 cup parmesan. Slide the chicken in, and any juices left on the plate.', '4. Serve the pasta topped with fresh parmesan and basil.']",622 kcal,6,https://www.halfbakedharvest.com/wp-content/uploads/2023/02/Spicy-Tuscan-Chicken-Pasta-1.jpg
Crispy Cheesy Sweet Potato Skins,{'minutes': '20'},"{'hours': '1', 'minutes': '10'}","{'hours': '1', 'minutes': '30'}","['medium sweet potatoes', 'salted butter, melted', 'garlic, grated', 'seasoned salt', 'chipotle chili powder', 'smoked paprika', 'kosher salt', 'grated parmesan cheese', 'shredded cheddar cheese', 'crispy bacon bits, for serving', 'avocado, cilantro, green onions, jalapeños, and sour cream, for serving']","{'medium sweet potatoes': '6', 'salted butter, melted': '2', 'garlic, grated': '1', 'seasoned salt': '2', 'chipotle chili powder': '2', 'smoked paprika': '1/2', 'kosher salt': 'seasoning', 'grated parmesan cheese': '1/4', 'shredded cheddar cheese': '1', 'crispy bacon bits, for serving': 'seasoning', 'avocado, cilantro, green onions, jalapeños, and sour cream, for serving': 'seasoning'}","['1. Preheat the oven to 425° F. Prick the sweet potatoes with a fork. Bake directly on the rack until tender, 35-40 minutes. Slice in half, then let cool.', '2. Use a fork to scoop most of the flesh out, leaving about 1/4 inch of the sweet potato in the skins. Arrange the skins on a parchment-lined baking sheet.', '3. Mix the melted butter with the seasoned salt, chipotle chili powder, paprika, and a pinch of salt. Spoon the seasoned butter over each potato skin. Sprinkle over the parmesan. Bake 15-20 minutes, until crisp. Add the cheddar cheese. Bake another 10 minutes, until the cheese is melted.', '4. Serve immediately topped with lots of bacon bits and an assortment of your favorite toppings. We love mashed avocado, yogurt/sour cream, green onion, cilantro, and candied jalapeños. ENJOY!!!']",350 kcal,6,https://www.halfbakedharvest.com/wp-content/uploads/2023/02/Crispy-Cheesy-Sweet-Potato-Skins-1.jpg
Spicy Chicken Yum Yum Rice Bowls,{'minutes': '20'},{'minutes': '25'},{'minutes': '45'},"['boneless skinless chicken breasts or thighs, thinly sliced', 'cornstarch or arrowroot powder', 'tamari or soy sauce', 'extra virgin olive oil', 'black pepper', 'orange juice', 'honey', 'chili paste', 'chopped fresh ginger', 'garlic, chopped', 'cooked rice', 'cucumber, avocado, kimchi, and fried wontons – for serving', 'olive oil mayo', 'ketchup', 'Worcestershire sauce', 'seasoned salt', 'cayenne']","{'boneless skinless chicken breasts or thighs, thinly sliced': '1 1/2', 'cornstarch or arrowroot powder': '1', 'tamari or soy sauce': '1', 'extra virgin olive oil': '2', 'black pepper': 'seasoning', 'orange juice': '2', 'honey': '1/4', 'chili paste': '2-3', 'chopped fresh ginger': '1', 'garlic, chopped': '2', 'cooked rice': '3-4', 'cucumber, avocado, kimchi, and fried wontons – for serving': 'seasoning', 'olive oil mayo': '1/3', 'ketchup': '2', 'Worcestershire sauce': '1', 'seasoned salt': '1', 'cayenne': '1/4'}","['1. Preheat the oven to 425° F.', '2 On a large sheet pan, toss the chicken with 1 tablespoon tamari and 1 tablespoon orange juice. Season with pepper. Sprinkle the cornstarch (or arrowroot powder) over the chicken, lightly toss. drizzle with olive oil. Bake 15 minutes.', '3. To make the sauce. In a bowl, whisk 1/3 cup tamari, 2 tablespoons orange juice, honey, chili paste, garlic, and ginger.', '4. When the chicken is ready, pour two-thirds of the sauce over the chicken. Toss and bake another 5 minutes, or until cooked through. Switch the oven to broil. Broil 1-2 minutes, until the chicken chars on the edges. If desired, spoon over the remaining sauce.', '5. Meanwhile, make the yum yum sauce. Combine all ingredients in a bowl. Taste and season with cayenne and salt.', '6. To assemble, add the rice to bowls, top with cucumber, avocado, chicken, kimchi, green onions, and a big handful of fried wontons. Spoon over the yum yum.']",425 kcal,6,https://www.halfbakedharvest.com/wp-content/uploads/2023/01/Spicy-Chicken-Yum-Yum-Rice-Bowls-1.jpg
30 Minute Coconut Curry Noodle Soup with Chili Crisp Chickpeas,{'minutes': '10'},{'minutes': '20'},{'minutes': '30'},"['extra-virgin olive oil', 'fresh chopped ginger', 'shallot, chopped', 'Thai red curry paste', 'full-fat coconut milk', 'low-sodium broth', 'fish sauce', 'creamy peanut butter', 'broccolini (or 3 cups spinach)', 'fresh cilantro or Thai basil, chopped', 'egg or rice noodles', 'limes and peanuts, for serving', 'chickpeas, drained, plus patted dry', 'tamari/soy sauce', 'pure maple syrup', 'flaked unsweetened coconut', 'sesame seeds', 'chili oil']","{'extra-virgin olive oil': '2', 'fresh chopped ginger': '1', 'shallot, chopped': '1', 'Thai red curry paste': '1/4', 'full-fat coconut milk': '2', 'low-sodium broth': '2-3', 'fish sauce': '3', 'creamy peanut butter': '3', 'broccolini (or 3 cups spinach)': '1', 'fresh cilantro or Thai basil, chopped': '1/4', 'egg or rice noodles': '8', 'limes and peanuts, for serving': 'seasoning', 'chickpeas, drained, plus patted dry': '1', 'tamari/soy sauce': '1/4', 'pure maple syrup': '1', 'flaked unsweetened coconut': '1/2', 'sesame seeds': '3', 'chili oil': '1/4'}","['1. To make the chickpeas. Preheat oven to 425° F.', '2. On a baking sheet, toss the chickpeas with olive oil, tamari, maple syrup, and pepper. Bake for 15 minutes. Add the coconut and sesame seeds, toss and bake 5-10 minutes, until extra crisp. Remove and toss with chili oil.', '3. To make the soup. In a large pot, set over medium heat, cook the olive oil with the shallots, ginger, and red curry paste. Cook until fragrant, about 2 minutes. Stir in the coconut milk, broth, fish sauce, peanut butter, and a pinch of black pepper. Simmer over medium heat, 5-8 minutes. Stir in the broccoli or spinach, and the cilantro.', '4. Meanwhile, cook the noodles according to package directions.', '5. Divide the noodles between bowls and ladle the soup over. Top each bowl with chickpeas, limes, and herbs.']",515 kcal,4,https://www.halfbakedharvest.com/wp-content/uploads/2023/01/30-Minute-Coconut-Curry-Noodle-Soup-1.jpg
Crispy Cauliflower Tacos with Candied Jalapeño Pineapple Salsa,{'minutes': '20'},{'minutes': '20'},{'minutes': '40'},"['extra virgin olive oil', 'chopped cauliflower florets', 'poblano pepper, chopped', 'yellow onion, chopped', 'chipotle chili powder', 'all-spice', 'ground ginger', 'cinnamon', 'kosher salt and black pepper', 'red enchilada sauce', 'hard shell tacos', 'shredded Mexican cheese', 'avocado, shredded lettuce, and cilantro', 'diced pineapple', 'diced mango', 'cilantro, chopped', 'candied or pickled jalapeños', 'pickled ginger']","{'extra virgin olive oil': '2', 'chopped cauliflower florets': '6', 'poblano pepper, chopped': '1', 'yellow onion, chopped': '1', 'chipotle chili powder': '2', 'all-spice': '1', 'ground ginger': '1/2', 'cinnamon': '1/4', 'kosher salt and black pepper': 'seasoning', 'red enchilada sauce': '1/2', 'hard shell tacos': '12', 'shredded Mexican cheese': '1', 'avocado, shredded lettuce, and cilantro': 'seasoning', 'diced pineapple': '1', 'diced mango': '1', 'cilantro, chopped': '1/2', 'candied or pickled jalapeños': '1/2', 'pickled ginger': '2'}","['1. Preheat the oven to 425° F.', '2. Heat the olive oil in a large skillet over high heat. Add the cauliflower, poblano pepper, and onion. Cook, stirring occasionally, until the cauliflower is soft, about 3 minutes. Add the chipotle chili powder, all-spice, ginger, cinnamon, and salt. Cook another 2 minutes, then pour in the enchilada sauce and 1/3 cup water. Reduce the heat to medium and simmer until the sauce has thickened slightly, about 5 minutes. Remove from the heat.', '3. Line the taco shells up on a sheet pan or in a 9×13 inch baking dish. Spoon the cauliflower into each taco shell and top with cheese. Bake 10 minutes, until the cheese has melted.', '4. Meanwhile, make the salsa. Combine all ingredients in a bowl. Season with salt.', '5. Serve the tacos topped with avocado, lettuce, cilantro, and lots of salsa. ENJOY!']",302 kcal,6,https://www.halfbakedharvest.com/wp-content/uploads/2023/01/Crispy-Caribbean-Cauliflower-Tacos-with-Candied-Jalapeño-Pineapple-Salsa-1-1.jpg
Sheet Pan Honey Mustard Salmon with Caesar Roasted Potatoes,{'minutes': '15'},{'minutes': '25'},{'minutes': '40'},"['potatoes, cut into 1/2 inch chunks', 'brussels sprouts, halved', 'extra virgin olive oil', 'kosher salt and black pepper', 'salmon fillets', 'honey', 'grainy dijon mustard', 'garlic, chopped', 'chili powder', 'cayenne', 'salted butter', 'extra virgin olive oil', 'tahini', 'lemon juice', 'dijon mustard', 'Worcestershire sauce', 'grated parmesan cheese, plus more for serving']","{'potatoes, cut into 1/2 inch chunks': '1/2', 'brussels sprouts, halved': '1/2', 'extra virgin olive oil': '1/2', 'kosher salt and black pepper': 'seasoning', 'salmon fillets': '4', 'honey': '2', 'grainy dijon mustard': '2', 'garlic, chopped': '2', 'chili powder': '1', 'cayenne': '1/2', 'salted butter': '3', 'tahini': '1/2', 'lemon juice': '1/4', 'dijon mustard': '1', 'Worcestershire sauce': '2', 'grated parmesan cheese, plus more for serving': '1/4'}","['1. Preheat oven to 450° F. On a baking sheet, toss the potatoes and brussels sprouts with 2 tablespoons olive oil. Season with salt and pepper. Roast for 15 minutes, or until tender.', '2.\xa0Meanwhile, whisk together the honey, mustard, garlic, chili powder, cayenne, and 2 tablespoons olive oil. Season with salt. Place the salmon on a plate and spoon the sauce evenly overtop.', '3. Remove the vegetables from the oven. Add the salmon to the baking sheet. Add the butter to each filet.\xa0Bake for 10 minutes, or until the salmon reaches your desired doneness. During the last minute, switch the oven to broil and broil until lightly charred.\xa0Watch close.', '4. To make the dressing. Combine all ingredients in a blender and blend until smooth. Add 1/4 to 1/2 cup water to thin the dressing. Taste and adjust the salt.', '5. As soon as you pull everything out, drench the vegetables in dressing, then top with extra parmesan. Serve the salmon and any sauce left on the pan over the potatoes. Add more dressing. Enjoy!']",789 kcal,4,https://www.halfbakedharvest.com/wp-content/uploads/2023/01/5X9A1999.jpg
Crispy Sesame Ginger Chicken Tacos,{'minutes': '30'},{'minutes': '15'},{'minutes': '45'},"['boneless chicken breasts, cut into cubes', 'egg white', 'tamari or soy sauce', 'orange zest', 'cornstarch', 'sesame or olive oil, for drizzling', 'tamari or soy sauce', 'orange juice + 2 tablespoons zest', 'honey or maple syrup', 'chili paste', 'creamy peanut butter', 'garlic, chopped', 'fresh grated ginger', 'toasted sesame seeds', 'hard shell tacos', 'nori sheets, lettuce, kimchi, cilantro, green onion, and queso fresco or your favorite cheese, for serving', 'yum yum style sauce, for serving']","{'boneless chicken breasts, cut into cubes': '1 1/2', 'egg white': '1', 'tamari or soy sauce': '1/2', 'orange zest': '1', 'cornstarch': '1/3', 'sesame or olive oil, for drizzling': 'seasoning', 'orange juice + 2 tablespoons zest': '1/3', 'honey or maple syrup': '2', 'chili paste': '1-3', 'creamy peanut butter': '2', 'garlic, chopped': '2-4', 'fresh grated ginger': '1', 'toasted sesame seeds': '2', 'hard shell tacos': '12', 'nori sheets, lettuce, kimchi, cilantro, green onion, and queso fresco or your favorite cheese, for serving': 'seasoning', 'yum yum style sauce, for serving': 'seasoning'}","['1. Preheat the oven to 475° F. Line a baking sheet with parchment paper or grease with oil.', '2. In a bowl, combine the chicken, egg white, tamari/soy sauce, and orange zest. Toss well to coat. In a separate bowl, add the cornstarch.', '3. Dredge the chicken through the cornstarch to coat. Place the chicken on the prepared baking sheet. Drizzle with oil. Bake for 8 minutes. Flip the chicken and bake another 3-5 minutes, until the chicken is cooked through. Switch the oven to broil.', '4. Meanwhile, whisk together the tamari/soy sauce, orange juice, honey/maple, chili paste, peanut butter, garlic, and ginger. Pour the sauce over the chicken, then toss to coat. Sprinkle with sesame seeds. Broil 1-3 minutes, until the sauce begins to stick to the chicken and thicken.', '5. Stuff the nori into shells (if desired). Add the chicken, then top as desired. Serve with any extra sauce from the sheet pan and/or yum yum style sauce (homemade in notes).']",391 kcal,6,https://www.halfbakedharvest.com/wp-content/uploads/2023/01/5X9A0635-scaled.jpg
Crispy Cauliflower Tzatziki Bowls with Sweet Potato Fries,{'minutes': '30'},{'minutes': '30'},{'hours': '1'},"['extra virgin olive oil', 'cauliflower florets', 'garlic, chopped', 'shallots, chopped', 'smoked paprika', 'chili powder', 'dried oregano', 'ground turmeric', 'kosher salt and black pepper', 'sweet potatoes, cut into matchsticks', 'seasoned salt (or paprika)', 'Persian cucumbers, chopped', 'avocado, diced', 'lemon juice', 'fresh dill, chopped', 'crumbled feta cheese', 'Tzatziki sauce', 'lettuce, peperoncini, and pitas, for serving']","{'extra virgin olive oil': '6', 'cauliflower florets': '4', 'garlic, chopped': '6', 'shallots, chopped': '2', 'smoked paprika': '2', 'chili powder': '2', 'dried oregano': '2', 'ground turmeric': '1', 'kosher salt and black pepper': 'seasoning', 'sweet potatoes, cut into matchsticks': '2', 'seasoned salt (or paprika)': '1', 'Persian cucumbers, chopped': '2', 'avocado, diced': '1', 'lemon juice': '2', 'fresh dill, chopped': '1/4', 'crumbled feta cheese': '6', 'Tzatziki sauce': '1-2', 'lettuce, peperoncini, and pitas, for serving': 'seasoning'}","['1. Preheat oven to 425° F.', '2. On a baking sheet, combine the cauliflower, 4 tablespoons olive oil, garlic, shallots, paprika, chili powder, oregano, turmeric, and a pinch each of salt and pepper. Toss well to evenly coat. Transfer to the oven and roast for 15 minutes, or until tender. Toss and roast another 10 minutes, until lightly charred.', '3. On a separate large baking sheet, toss the sweet potatoes with 2 tablespoons olive oil, seasoned salt, and a pinch of pepper. Bake 15 minutes, toss, then bake another 10 minutes until the potatoes are crispy.', '4. Meanwhile, combine the cucumbers, avocado, lemon, dill, salt, and pepper.', '5. To assemble, add lettuce to a bowl. Top with cauliflower, sweet potatoes, cucumber/avocado, feta, and any other desired toppings. Add a few dollops of Tzatziki sauce. Drizzle over the tahini. Serve with pitas.']",415 kcal,6,https://www.halfbakedharvest.com/wp-content/uploads/2023/01/Cauliflower-Tzatziki-Bowls-with-Sweet-Potato-Fries-1.jpg
BBQ Salmon Bowls with Mango Jalapeño Sauce,{'minutes': '20'},{'minutes': '10'},{'minutes': '30'},"['salmon filets', 'extra virgin olive oil', 'honey or brown sugar', 'chili powder', 'smoked paprika', 'dried thyme', 'onion powder', 'kosher salt', 'garlic, chopped', 'salted butter', 'chili flakes', 'rice for, serving', 'diced mango', 'avocado, cubed', 'jalapeños, seeded – if desired, and chopped', 'cilantro, chopped', 'fresh basil, chopped', 'lime juice']","{'salmon filets': '4', 'extra virgin olive oil': '1/4', 'honey or brown sugar': '1', 'chili powder': '2', 'smoked paprika': '2', 'dried thyme': '2', 'onion powder': '1', 'kosher salt': 'seasoning', 'garlic, chopped': '4', 'salted butter': '4', 'chili flakes': 'seasoning', 'rice for, serving': '3-4', 'diced mango': '1 1/2', 'avocado, cubed': '1', 'jalapeños, seeded – if desired, and chopped': '1-2', 'cilantro, chopped': '1/2', 'fresh basil, chopped': '1/2', 'lime juice': '2'}","['1. Preheat the oven to 450° F.', '2. On a baking sheet, rub the salmon with olive oil, honey, chili powder, paprika, dried thyme, onion powder, and a pinch of salt. Arrange in a single layer. Roast 10-15 minutes or until the fish is cooked to your liking.', '3. Remove the pan and then rub the salmon with garlic, add a pat of butter to each filet. Sprinkle with chili flakes. Switch the oven to broil and broil until lightly charred.', '4. To make the salsa. Combine all ingredients in a bowl.', '5. Serve the salmon over bowls of rice. Drizzle the butter over the salmon and top with basil or cilantro. Jalapeño sauce recipe in notes.']",297 kcal,4,https://www.halfbakedharvest.com/wp-content/uploads/2023/01/BBQ-Salmon-Rice-Bowls-with-Mango-Jalapeño-Salsa-1.jpg
Spicy Short Rib Peanut Ramen,{'minutes': '25'},{'hours': '4'},"{'hours': '4', 'minutes': '25'}","['beef short ribs, bone-in or out, fat trimmed', 'low sodium beef or chicken broth', 'full-fat coconut milk', 'tamari or soy sauce', 'chili paste, to taste', 'creamy peanut butter', 'shallots, sliced', 'garlic, chopped', 'fresh chopped ginger', 'bay leaves', 'cinnamon stick', 'baby spinach', 'dry ramen noodles', 'kimichi, cilantro, and green onion, for serving', 'chili oil, nori sheets, and sesame seeds, for serving']","{'beef short ribs, bone-in or out, fat trimmed': '3-5', 'low sodium beef or chicken broth': '8', 'full-fat coconut milk': '1', 'tamari or soy sauce': '1/3', 'chili paste, to taste': '2-4', 'creamy peanut butter': '1/4', 'shallots, sliced': '6', 'garlic, chopped': '6', 'fresh chopped ginger': '1', 'bay leaves': '2', 'cinnamon stick': '1', 'baby spinach': '3', 'dry ramen noodles': '4-6', 'kimichi, cilantro, and green onion, for serving': 'seasoning', 'chili oil, nori sheets, and sesame seeds, for serving': 'seasoning'}","['1. In the bowl of the crockpot, season the short ribs with pepper. Pour over the broth, coconut milk, and tamari. Add the chili paste, peanut butter, shallots, garlic, ginger, bay leaves, and cinnamon stick. Cover and cook on low for 6-8 hours or on high for 4-6 hours.', '2. Preheat the broiler to high. Remove the short ribs from the crockpot and place onto a baking sheet. Break into a few chunks and discard any bones. Broil until caramelized on top, about 3-5 minutes, but watch closely.', '3. Meanwhile, crank the heat on the slow cooker to high. Stir in the spinach and noodles and let cook, uncovered, for about 5 minutes. Stir in the short ribs.', '4. Ladle the broth, short ribs, spinach, and noodles into bowls. Top as desired with kimchi, cilantro, green onions, chili oil, and sesame seeds. Serve immediately.']",570 kcal,6,https://www.halfbakedharvest.com/wp-content/uploads/2023/01/Spicy-Short-Rib-Peanut-Ramen-1.jpg
Baked Crunchy Hot Honey Chicken,{'minutes': '15'},{'minutes': '25'},{'minutes': '40'},"['cornflakes', 'grated parmesan cheese', 'smoked paprika', 'onion powder', 'garlic powder', 'large eggs, beaten', 'hot sauce', 'chicken breast tenderloins', 'extra virgin olive oil, for drizzling', 'honey', 'hot sauce', 'cayenne pepper', 'chipotle chili powder', 'garlic powder', 'onion powder', 'sea salt', 'fresh thyme, cilantro, or parsley, for serving']","{'cornflakes': '6', 'grated parmesan cheese': '1/4', 'smoked paprika': '1', 'onion powder': '1/2', 'garlic powder': '1/2', 'large eggs, beaten': '2', 'hot sauce': '2-3', 'chicken breast tenderloins': '2', 'extra virgin olive oil, for drizzling': 'seasoning', 'honey': '1/2', 'cayenne pepper': '1-3', 'chipotle chili powder': '3/4', 'sea salt': 'seasoning', 'fresh thyme, cilantro, or parsley, for serving': 'seasoning'}","['1. Preheat the oven to 425° F. Line a baking sheet with parchment paper.', '2. In a food processor, combine the cornflakes, parmesan, paprika, onion powder, garlic powder, and a pinch of salt. Pulse until you have fine crumbs. Alternatively, you can crush the crumbs in a ziplock bag by stepping on them. Dump the crumbs into a shallow bowl.', '3. Beat the eggs in a bowl, add the hot sauce and chicken, and toss well to coat.', '3. Dredge the chicken through the crumbs, covering fully. Place on the prepared baking sheet. For a thicker coating, dip the chicken back through the eggs, then through the crumbs a 2nd time. Place on the prepared baking sheet. Drizzle with olive oil. Bake for 20-25 minutes, until crisp all around.', '4. Just before the chicken is done cooking, make the sauce. In a sauce pot, warm together the honey, hot sauce, cayenne, chili powder, onion powder, and garlic powder, plus a pinch of salt.', '5. Drizzle the warm sauce over the chicken. Top with herbs. If the sauce thickens, warm for 5 seconds in the microwave. Enjoy!']",403 kcal,6,https://www.halfbakedharvest.com/wp-content/uploads/2023/01/Baked-Crunchy-Hot-Honey-Chicken-1.jpg
-,-,-,-,-,-,-,-,-,https://www.halfbakedharvest.com/wp-content/uploads/2021/11/Creamy-White-Chicken-Chili-1.jpg
Salsa Verde Chicken and Rice Tortilla Soup.,{'minutes': '15'},{'minutes': '30'},{'minutes': '45'},"['extra virgin olive oil', 'yellow onion, chopped', 'boneless skinless chicken thighs or breasts', 'chili powder', 'smoked paprika', 'dried oregano', 'kosher salt and black pepper', 'poblano peppers, chopped', 'salsa verde', 'low sodium chicken broth', 'black beans, drained', 'lime juice', 'cilantro, chopped', 'cooked rice', 'tortilla chips, for serving', 'yogurt, avocado, cheese, and green onions, for serving']","{'extra virgin olive oil': '2', 'yellow onion, chopped': '1', 'boneless skinless chicken thighs or breasts': '1', 'chili powder': '2', 'smoked paprika': '2', 'dried oregano': '1', 'kosher salt and black pepper': 'seasoning', 'poblano peppers, chopped': '1-2', 'salsa verde': '2', 'low sodium chicken broth': '6', 'black beans, drained': '1', 'lime juice': '2', 'cilantro, chopped': '1/2', 'cooked rice': '3', 'tortilla chips, for serving': 'seasoning', 'yogurt, avocado, cheese, and green onions, for serving': 'seasoning'}","['1. Heat the olive oil in a large pot over medium heat. Add the onion and cook until fragrant, 5 minutes. Stir in the poblano peppers, chicken, chili powder, paprika, oregano, and a pinch each of salt and pepper. Cook 5 minutes, until you smell the seasonings.', '2. Stir in the broth and salsa verde. Season with salt and pepper. Partially cover and simmer over medium-low heat for 15 minutes, until the chicken is cooked.', '3. Shred the chicken using 2 forks, then stir back into the soup. Add the beans, lime juice, and cilantro. Cook 10 minutes, to warm through, or up to 3 hours over the lowest heat possible. If needed, thin with additional broth.', '4. Stir the rice into the soup, then ladle into bowls. Top, as desired, with yogurt, cheese, avocado, cilantro, and green onions. Grab a handful of tortilla chips, and serve crushed over the soup or alongside the soup for scooping. Zest lime over each bowl. Enjoy!']",321 kcal,6,https://www.halfbakedharvest.com/wp-content/uploads/2022/12/Salsa-Verde-Chicken-and-Rice-Tortilla-Soup-1.jpg
