title,prep_time,cook_time,total_time,ingredients,ingredients with measurement,instructions,calories,servings,images
Brie and Cheddar Apple Beer Soup,{'minutes': '15'},{'minutes': '25'},{'minutes': '40'},"['salted butter', 'extra virgin olive oil', 'small yellow onion, chopped', 'fresh thyme leaves', 'chopped fresh sage', 'all-purpose flour', 'whole milk', 'low sodium veggie or chicken broth', 'pumpkin beer', 'apple cider', 'Honeycrisp apple, chopped', 'shredded sharp cheddar cheese', 'creamy brie, cubed', 'cayenne, more or less to taste', 'kosher salt and black pepper']","{'salted butter': '3', 'extra virgin olive oil': '2', 'small yellow onion, chopped': '1', 'fresh thyme leaves': '2', 'chopped fresh sage': '1', 'all-purpose flour': '1/4', 'whole milk': '2', 'low sodium veggie or chicken broth': '2', 'pumpkin beer': '1', 'apple cider': '1/2', 'Honeycrisp apple, chopped': '1', 'shredded sharp cheddar cheese': '2-3', 'creamy brie, cubed': '4', 'cayenne, more or less to taste': '1/4', 'kosher salt and black pepper': '1'}","['1. Melt together the butter and olive oil in a large pot over medium heat. Add the onion, thyme, and sage, cook until fragrant, about 5 minutes. Whisk in the flour and cook until golden, about 1 minute, gradually whisk in the milk until smooth. Add the broth, beer, cider, apple, and a large pinch each of salt and pepper. Bring to a simmer, reduce the heat to medium and cook, uncovered, until the apple is tender, about 10 minutes.', '2. Remove the soup from the stove. Puree in a blender or use an immersion blender.', '3. Return the soup to the stove and set over low heat. Stir in the cheddar cheese and brie until melted and creamy. Add the cayenne.', '4. Ladle the soup into bowls and top with a little extra cheddar and fresh thyme. Enjoy…preferably with soft pretzels on the side.']",734 kcal,6,https://www.halfbakedharvest.com/wp-content/uploads/2021/09/Brie-and-Cheddar-Apple-Beer-Soup-1.jpg
Slow Cooker Mustard Herb Chicken and Creamy Orzo,{'minutes': '15'},{'hours': '4'},"{'hours': '4', 'minutes': '15'}","['boneless chicken breasts', 'extra virgin olive oil', 'dijon mustard', 'fresh thyme leaves', 'fresh chopped sage', 'garlic, chopped', 'kosher salt and black pepper', 'shallots, quartered', 'dry white wine, such as Pinot Grigio or Sauvignon Blanc', 'apple cider or chicken broth', 'juice of 1 lemon', 'salted butter', 'dry orzo pasta', 'chopped broccoli', 'heavy cream or canned full fat coconut milk', 'freshly grated parmesan cheese']","{'boneless chicken breasts': '2', 'extra virgin olive oil': '1', 'dijon mustard': '2', 'fresh thyme leaves': '2', 'fresh chopped sage': '1', 'garlic, chopped': '2', 'kosher salt and black pepper': 'seasoning', 'shallots, quartered': '2', 'dry white wine, such as Pinot Grigio or Sauvignon Blanc': '1', 'apple cider or chicken broth': '1', 'juice of 1 lemon': 'seasoning', 'salted butter': '2', 'dry orzo pasta': '2', 'chopped broccoli': '1 1/2', 'heavy cream or canned full fat coconut milk': '1/3', 'freshly grated parmesan cheese': '1/3'}","['1. In the bowl of your slow cooker,\xa0rub the chicken with the olive oil, mustard thyme, sage, garlic, salt, and pepper. Pour over the wine, cider and lemon juice. Add the shallots. Cover and cook on low for 3- 4 hours or on high for 1-2 hours.', '2. Preheat the broiler to high. Remove the chicken from the slow cooker place it on a baking sheet.', '3. Crank the heat on the slow cooker to high. Stir in the orzo, broccoli, and 1 cup water. Cover and cook 20-30 minutes, or until the orzo is al dente. If the orzo needs more liquid, add additional water. Stir in the cream and parmesan.', '4. Place the butter on the chicken, then broil 1-3 minutes, until crisp. Serve the chicken over the orzo. Enjoy!']",641 kcal,6,https://www.halfbakedharvest.com/wp-content/uploads/2021/09/Slow-Cooker-Mustard-Herb-Chicken-and-Creamy-Orzo-1.jpg
Sesame Ginger Dumplings in Chili Oil,{'minutes': '30'},{'minutes': '30'},{'hours': '1'},"['small acorn squash, sliced, or 4 cups cubed butternut squash', 'extra virgin olive oil', 'ground ginger', 'ground cinnamon', 'cayenne pepper', 'honey', 'low sodium soy sauce or tamari', 'round dumpling or wonton wrappers', 'toasted sesame seeds, for serving', 'ground chicken or pork', 'ground ginger', 'garlic, grated', 'chopped green onions', 'low sodium soy sauce or tamari', 'black pepper', 'sesame oil', 'garlic, smashed', 'shallot, quartered', 'bay leaf', 'crushed red pepper flakes, to taste']","{'small acorn squash, sliced, or 4 cups cubed butternut squash': '2', 'extra virgin olive oil': '2', 'ground ginger': '1', 'ground cinnamon': '1/2', 'cayenne pepper': '1/2', 'honey': '2', 'low sodium soy sauce or tamari': '1/3', 'round dumpling or wonton wrappers': '24-26', 'toasted sesame seeds, for serving': 'seasoning', 'ground chicken or pork': '1', 'garlic, grated': '1', 'chopped green onions': '4', 'black pepper': 'seasoning', 'sesame oil': '3/4', 'garlic, smashed': '4', 'shallot, quartered': '1', 'bay leaf': '1', 'crushed red pepper flakes, to taste': '1-3'}","['1. To make the Squash Dumplings: Preheat the oven to 425° F. On a baking sheet, toss together the squash, olive oil, ginger, cinnamon, cayenne, and honey. Bake for 25-30 minutes, or until tender.', '2. Peel the squash skin away from the acorn squash and add the squash to a bowl. Add the soy sauce to the squash and mash together.', '3. To make the Chicken Dumplings: combine all ingredients in a bowl.', '4. To assemble the Dumplings: spoon 2 teaspoons of filling onto each wrapper. Brush water around the edges of the wrapper.\xa0Fold the edges of the wrapper up and around the filling and pinch to seal.\xa0Repeat with the remaining filling.', '5. To make the chili oil. In a medium skillet, combine the sesame oil, garlic, shallot, and bay leaf. Cook over medium heat until the garlic turns golden. Remove from the heat and stir in the chili flakes. Season with salt.', '6. Bring a large pot of salted water to a boil. Boil the dumplings until they float, 3-4 minutes. Toss the warm dumplings in the chili oil. Serve topped with green onions and sesame seeds.']",1912 kcal,6,https://www.halfbakedharvest.com/wp-content/uploads/2021/09/Sesame-Ginger-Dumplings-in-Chili-Oil-1-700x1050.jpg
4 Cheese Roasted Garlic Alfredo Stuffed Spaghetti Squash,{'minutes': '15'},{'minutes': '45'},{'hours': '1'},"['whole milk or heavy cream', 'frozen chopped spinach, thawed and squeezed dry', 'chopped fresh sage', 'fresh thyme leaves', 'shredded fontina cheese', 'shredded mozzarella or creamy gouda', 'shredded provolone cheese', 'medium spaghetti squash, halved and seeds removed', 'grated parmesan', 'kosher salt and black pepper', 'garlic', 'olive oil', 'salted butter, at room temperature']","{'whole milk or heavy cream': '1 1/4', 'frozen chopped spinach, thawed and squeezed dry': '6', 'chopped fresh sage': '2', 'fresh thyme leaves': '1', 'shredded fontina cheese': '1', 'shredded mozzarella or creamy gouda': '1/2', 'shredded provolone cheese': '1', 'medium spaghetti squash, halved and seeds removed': '2', 'grated parmesan': '1/4', 'kosher salt and black pepper': 'seasoning', 'garlic': '1', 'olive oil': 'seasoning', 'salted butter, at room temperature': '2'}","['1. Preheat the oven to 425° F.', '2. In a medium bowl, mix together the milk, spinach, sage, thyme, fontina, and mozzarella. Season with red pepper flakes, salt, and pepper.', '3. Place the squash in a baking dish and season the cut sides with salt and pepper. Sprinkle 1/2 of the provolone cheese into the bottom of each squash, then evenly divide the milk/cheese mix among the squash cavities. Top with the remaining provolone and parmesan. Cover the squash with foil.', '4. Slice off the top portion of the garlic head to expose some of the cloves. Place the garlic on a piece of foil. Drizzle with olive oil and wrap it up.', '5. Bake the squash and garlic for 30 minutes. Remove the foil from both and continue baking the squash and garlic another 15-20 minutes or until the squash is tender and the cheese is golden brown on top.', '6. Let the garlic cool, then squeeze the cloves out into a bowl. Add the butter and 1 tablespoon sage. Mash the cloves into the butter with a fork. Spread the butter over the squash, then use a fork to scrape the squash into strands, mixing the cheese with the squash. Enjoy!']",499 kcal,6,https://www.halfbakedharvest.com/wp-content/uploads/2021/09/4-Cheese-Roasted-Garlic-Alfredo-Stuffed-Spaghetti-Squash-1-700x1050.jpg
Butternut Squash and Cheese Stuffed Pasta Shells,{'minutes': '30'},{'minutes': '45'},"{'hours': '1', 'minutes': '15'}","['extra virgin olive oil', 'cubed butternut squash', 'fresh thyme leaves', 'red pepper flakes', 'kosher salt and black pepper', 'prosciutto', 'jumbo shells', 'whole milk ricotta cheese', 'shredded fontina or provolone cheese', 'Mezzetta Artisan Ingredients Marinara Sauce', 'mozzarella, torn', 'fresh basil, for serving']","{'extra virgin olive oil': '1', 'cubed butternut squash': '2', 'fresh thyme leaves': '2', 'red pepper flakes': '1', 'kosher salt and black pepper': '1', 'prosciutto': '3', 'jumbo shells': '1', 'whole milk ricotta cheese': '1 1/2', 'shredded fontina or provolone cheese': '2', 'Mezzetta Artisan Ingredients Marinara Sauce': '4', 'mozzarella, torn': '8', 'fresh basil, for serving': 'seasoning'}","['1. Preheat oven to 425° F. On a baking sheet, toss together the olive oil, butternut squash, thyme, and a pinch each of red pepper flakes, salt, and pepper. Lay the prosciutto over the squash. Bake for 15-25 minutes, until the prosciutto is crispy. Remove the prosciutto and set aside. If squash needs more time, return to the oven for another 10 minutes, or until the squash is tender.', '2. Meanwhile, bring a large pot of salted water to a boil. Boil the pasta until al dente according to package directions. Drain.', '3. In a medium bowl, combine the ricotta, fontina, and roasted butternut squash. Season with salt and pepper.', '4. To assemble, spoon 2-3 cups marinara sauce into the bottom of a 9×13 inch baking dish. Stuff each shell with 1 tablespoon of the cheese and place into the baking dish with sauce. Top with the remaining marinara sauce and mozzarella. Bake 20-25 minutes or until the cheese has melted and is lightly browned on top.', '5. Serve the shells topped with prosciutto and basil. Enjoy!']",813 kcal,6,https://www.halfbakedharvest.com/wp-content/uploads/2021/09/Butternut-Squash-and-Cheese-Stuffed-Pasta-Shells-1-700x1050.jpg
Sheet Pan Hot Honey Mustard Chicken and Crispy Brussels Sprouts.,{'minutes': '15'},{'minutes': '25'},{'minutes': '40'},"['boneless chicken breasts or thighs', 'egg', 'finely crushed corn flakes', 'whole wheat flour', 'kosher sale', 'extra virgin olive oil, plus more for drizzling', 'Brussels sprouts, halved', 'shallots, quartered', 'fresh thyme', 'salted butter, melted', 'honey', 'dijon mustard', 'lemon juice', 'smoked paprika', 'cayenne pepper', 'garlic powder', 'kosher salt']","{'boneless chicken breasts or thighs': '2', 'egg': '1', 'finely crushed corn flakes': '2', 'whole wheat flour': '2', 'kosher sale': 'seasoning', 'extra virgin olive oil, plus more for drizzling': '2', 'Brussels sprouts, halved': '1', 'shallots, quartered': '2', 'fresh thyme': '2', 'salted butter, melted': '4', 'honey': '1/4', 'dijon mustard': '1/4', 'lemon juice': '2', 'smoked paprika': '1/2', 'cayenne pepper': '1-2', 'garlic powder': '1/2', 'kosher salt': 'seasoning'}","['1. Preheat the oven to 450° F. Line a baking sheet with parchment paper or grease with oil.', '2. Add the chicken and egg to a bowl. Toss to combine. Add the cornflakes, flour, and a pinch of salt to another bowl. Dredge the chicken in batches through the crumbs, tossing to coat. Place the chicken on one side of the prepared baking sheet. Drizzle with olive oil.', '3. Add the Brussels sprouts and shallots to the other side of the pan and toss with 2 tablespoons oil, salt, and pepper. Bake for 20 minutes, until the chicken is cooked through. Reduce the oven temp to 400° F.', '4. Meanwhile, make the sauce. Combine all ingredients in a bowl until smooth and creamy. If the sauce stiffens, warm in the microwave or on the stove.', '5. Spoon the sauce over the chicken, coating each piece. Toss the sprouts with 1 tablespoon oil. Return everything to the oven for 3-5 minutes.', 'Roast again in hot oven until sauce starts to bubble, 1-2 minutes.', 'Plate dish add seasoning with a pinch of\xa0salt\xa0(to taste).']",619 kcal,6,https://www.halfbakedharvest.com/wp-content/uploads/2021/09/Sheet-Pan-Hot-Honey-Mustard-Chicken-and-Crispy-Brussels-Sprouts-1-700x1050.jpg
Sheet Pan Sticky Sweet and Sour Chicken,{'minutes': '15'},{'minutes': '20'},{'minutes': '35'},"['boneless chicken breasts, cut into 2 inch cubes', 'egg, beaten', 'all-purpose flour, or gluten-free all-purpose flour', 'ground ginger', 'kosher salt and black pepper', 'broccoli florets', 'bell peppers, sliced', 'shallots, quartered', 'extra virgin olive oil or sesame oil', 'sweet Thai chili sauce', 'low sodium soy sauce', 'apple juice', 'rice vinegar', 'ketchup', 'creamy peanut butter', 'jalapeño, sliced, and seeded if desired', 'garlic, grated', 'rice and cilantro, for serving']","{'boneless chicken breasts, cut into 2 inch cubes': '1 1/2', 'egg, beaten': '1', 'all-purpose flour, or gluten-free all-purpose flour': '1/4', 'ground ginger': '1', 'kosher salt and black pepper': '1', 'broccoli florets': '1', 'bell peppers, sliced': '2', 'shallots, quartered': '2', 'extra virgin olive oil or sesame oil': '4', 'sweet Thai chili sauce': '1', 'low sodium soy sauce': '1/3', 'apple juice': '1/2', 'rice vinegar': '1/4.', 'ketchup': '1', 'creamy peanut butter': '1', 'jalapeño, sliced, and seeded if desired': '1', 'garlic, grated': '2', 'rice and cilantro, for serving': 'seasoning'}","['1. Preheat the oven to 475° F. Line a baking sheet with parchment paper or grease with oil.', '2. Add the chicken, egg, and a pinch of pepper to a bowl. Toss to combine. Add the flour and ginger to another bowl. Dredge the chicken in batches through the flour, tossing to coat. Place the chicken on one side of the prepared baking sheet. Drizzle with 2 tablespoons oil. Add the broccoli, peppers, and shallots to the other side of the pan and toss with 2 tablespoons oil. Bake 15 minutes.', '3. Reduce the oven temp to 400° F.', '4. Meanwhile, combine the sweet Thai chili sauce, soy sauce, apple juice, rice vinegar, ketchup, peanut butter, jalapeño, and garlic in a medium saucepan. Set over medium-high heat and bring the sauce to a boil. Boil 5-8 minutes, until the sauce thickens and reduces by about 1/3. Remove from the heat.', '5. Pour half the sauce over the chicken, tossing to combine. Toss the vegetables. Return everything to the oven for 3 minutes, until the sauce coats the chicken. Watch closely, the sauce can burn easily.', '6. Serve the chicken and the remaining sauce over bowls of rice topped with cilantro. Serve the vegetables on the side.']",428 kcal,6,https://www.halfbakedharvest.com/wp-content/uploads/2021/09/Sheet-Pan-Sticky-Sweet-and-Sour-Chicken-1-700x1050.jpg
Easy Baked Cheesy Cauliflower Pizzas,{'minutes': '10'},{'minutes': '20'},{'minutes': '30'},"['medium heads of cauliflower, sliced into 1 1/2 inch slices', 'extra virgin olive oil', 'fresh thyme leaves', 'chopped fresh oregano', 'smoked paprika', 'garlic powder', 'onion powder', 'kosher salt and black pepper', 'marinara sauce', 'shredded mozzarella cheese', 'shredded fontina cheese', 'grated parmesan cheese', 'sliced pepperoni', 'basil, for serving']","{'medium heads of cauliflower, sliced into 1 1/2 inch slices': '2', 'extra virgin olive oil': '2', 'fresh thyme leaves': '2', 'chopped fresh oregano': '2', 'smoked paprika': '1', 'garlic powder': '1', 'onion powder': '1/2', 'kosher salt and black pepper': 'seasoning', 'marinara sauce': '1', 'shredded mozzarella cheese': '1', 'shredded fontina cheese': '1', 'grated parmesan cheese': '1/2', 'sliced pepperoni': '3', 'basil, for serving': 'seasoning'}","['1. Preheat the oven to 450° F.', '2. Stand the\xa0cauliflower on its stem, cut them in to 1½ inch slices. Place on a baking sheet and rub with olive oil.', '3. In a bowl, combine the thyme, oregano, paprika, garlic, and onion powder. Sprinkle over the cauliflower, then season with salt and pepper. Bake 15 minutes.', '4. Remove from the oven and spoon over the marinara sauce. Top with equal amounts of the cheeses and then the pepperoni. Bake 5 minutes, then switch the oven to broil and broil 1-2 minutes, until the cheese is melted.', '5. Top with fresh basil. Enjoy!']",455 kcal,4,https://www.halfbakedharvest.com/wp-content/uploads/2021/09/Easy-Baked-Cheesy-Cauliflower-Pizzas-1-700x1050.jpg
Spicy Lemon Butter Shrimp Scampi with Herbed Corn,{'minutes': '10'},{'minutes': '15'},{'minutes': '25'},"['dry pasta', 'extra virgin olive oil', 'salted butter', 'shallot, chopped', 'garlic, chopped', 'corn on the cob, kernels removed', 'fresh thyme leaves', 'chili powder', 'cayenne pepper', 'kosher salt and black pepper', 'chili flakes', 'raw shrimp, peeled and deveined', 'dry white wine,', 'juice from 1 lemon', 'basil pesto', 'fresh chopped chives']","{'dry pasta': '1', 'extra virgin olive oil': '2', 'salted butter': '1', 'shallot, chopped': '1', 'garlic, chopped': '6', 'corn on the cob, kernels removed': '3', 'fresh thyme leaves': '2', 'chili powder': '1/2-1', 'cayenne pepper': '1/4', 'kosher salt and black pepper': 'seasoning', 'chili flakes': 'seasoning', 'raw shrimp, peeled and deveined': '1 1/2', 'dry white wine,': '1/2', 'juice from 1 lemon': 'seasoning', 'basil pesto': '1/4', 'fresh chopped chives': '2'}","['1. Bring a large pot of salted water to a boil. Cook the pasta according to package directions until al dente. Drain and toss with olive oil.', '2. Meanwhile, melt together the butter, garlic, and shallots. Cook 1 minute, until the garlic is fragrant. Add the corn, thyme, chili powder, cayenne, chili flakes, and season with salt and pepper. Cook until the butter begins to brown around the corn, about 3-4 minutes.', '3. Stir in the shrimp, tossing with the butter. Pour in the wine and lemon juice, bring to a boil. Cook until the shrimp is pink, 4-5 minutes. Remove from the heat and stir in the pesto and chives.', '4. Divide the pasta between bowls. Spoon the shrimp and sauce over the pasta and give it a nice toss. Serve topped with fresh basil and thyme.']",576 kcal,6,https://www.halfbakedharvest.com/wp-content/uploads/2021/08/Spicy-Lemon-Butter-Shrimp-Scampi-with-Herbed-Corn-1-700x1050.jpg
Cheesy Buffalo Chicken Strombolis,{'minutes': '20'},{'minutes': '30'},{'minutes': '50'},"['pizza dough', 'cooked shredded chicken', 'buffalo sauce', 'fresh cilantro or parsley, chopped', 'chopped fresh chives', 'jalapeño, seeded and chopped', 'ranch dressing', 'crumbled blue cheese', 'shredded whole milk mozzarella', 'shredded cheddar cheese', 'grated parmesan or asiago cheese', 'sesame seeds', 'Italian seasoning', 'egg, beaten']","{'pizza dough': '1', 'cooked shredded chicken': '1', 'buffalo sauce': '1/2', 'fresh cilantro or parsley, chopped': '1/2', 'chopped fresh chives': '2', 'jalapeño, seeded and chopped': '1', 'ranch dressing': '1/2', 'crumbled blue cheese': '1/2', 'shredded whole milk mozzarella': '1', 'shredded cheddar cheese': '1', 'grated parmesan or asiago cheese': '1/2', 'sesame seeds': '1', 'Italian seasoning': '1', 'egg, beaten': '1'}","['1. Preheat the oven to 450° F. Line a baking sheet with parchment paper.', '2.In a bowl, combine the chicken, buffalo sauce, cilantro, chives, and jalapeño.', '3. Divide the pizza dough into 4 balls. On a floured surface, roll the dough into about an 8-inch circle/oval. Spread each piece of dough with ranch, then add buffalo chicken on top in an even layer. Top with equal amounts of mozzarella and cheddar. Drizzle with additional buffalo sauce, if desired. Tuck in two sides of the dough, then roll up into a log (like a cinnamon roll), pinch to seal. Place seam side down on the prepared baking sheet.', '4. In a bowl, combine the parmesan, sesame seeds, and Italian seasoning. Brush the tops of the stromboli with the beaten egg, then sprinkle with the parmesan. Take a sharp knife and cut 2 small slits in the top of the dough.', '5. Bake for 10 minutes, then reduce the heat to 375° and bake another 20 to 30 minutes or until golden brown on top. Serve with additional buffalo sauce and/or ranch. ENJOY!']",568 kcal,6,https://www.halfbakedharvest.com/wp-content/uploads/2021/08/Cheesy-Buffalo-Chicken-Strombolis-1-700x1050.jpg
Brown Butter Cherry Tomato Fettuccine Alfredo,{'minutes': '15'},{'minutes': '15'},{'minutes': '30'},"['fettuccine pasta', 'extra virgin olive oil', 'small cherry tomatoes', 'freshly chopped sage', 'red pepper flakes', 'kosher salt and black pepper', 'salted butter', 'garlic, chopped', 'freshly chopped oregano', 'whole milk or canned coconut milk', 'heavy cream or canned coconut milk', 'cream cheese', 'grated Parmesan or Pecorino Romano', 'freshly chopped basil']","{'fettuccine pasta': '1', 'extra virgin olive oil': '2', 'small cherry tomatoes': '2', 'freshly chopped sage': '2', 'red pepper flakes': '1', 'kosher salt and black pepper': '1', 'salted butter': '4', 'garlic, chopped': '3', 'freshly chopped oregano': '1', 'whole milk or canned coconut milk': '2', 'heavy cream or canned coconut milk': '1/2', 'cream cheese': '2', 'grated Parmesan or Pecorino Romano': '1 1/2', 'freshly chopped basil': '1'}","['1. Bring a large pot of salted water to a boil. Cook the pasta according to package directions until al dente. Drain.', '2. Meanwhile, heat a large skillet over medium heat. Add the olive oil, tomatoes, 1 tablespoon sage, and a pinch each of red pepper flakes, salt, and pepper. Cook until the tomatoes just begin to burst, about 8 minutes. Remove from the skillet to a plate.', '3. To the same skillet, melt the butter over medium heat, cooking until the butter begins to brown, about 3-4 minutes.\xa0Reduce the heat to low, add the garlic, oregano, 1 tablespoon sage, and a pinch of crushed red pepper. Cook 1 minute, then pour in the milk and cream. Add the cream cheese. Whisk until smooth. Bring the sauce to a gentle simmer and cook 5-8 minutes, until thickened slightly. Stir in the parmesan. Season with salt + pepper. Toss in the pasta and basil and cook 3-5 minutes, then remove from the heat.', '4. Divide the fettuccine between plates and top with tomatoes. Eat and enjoy immediately.']",731 kcal,6,https://www.halfbakedharvest.com/wp-content/uploads/2021/08/Brown-Butter-Cherry-Tomato-Fettuccine-Alfredo-1-700x1050.jpg
25 Minute Black Pepper Jalapeño Basil Chicken Stir Fry,{'minutes': '10'},{'minutes': '15'},{'minutes': '25'},"['boneless skinless chicken thighs or breasts, thinly sliced', 'cornstarch', 'ground turmeric', 'ground ginger', 'black pepper', 'sesame oil or extra virgin olive oil', 'low sodium soy sauce', 'honey', 'rice vinegar', 'fish sauce', 'bell peppers, sliced', 'jalapeños, seeded, if desired, and sliced', 'shallot, sliced', 'fresh Thai or regular basil chopped']","{'boneless skinless chicken thighs or breasts, thinly sliced': '1 1/2', 'cornstarch': '1', 'ground turmeric': '1', 'ground ginger': '1', 'black pepper': '1-2', 'sesame oil or extra virgin olive oil': '3', 'low sodium soy sauce': '1/3', 'honey': '1/4', 'rice vinegar': '2', 'fish sauce': '1', 'bell peppers, sliced': '2', 'jalapeños, seeded, if desired, and sliced': '1-2', 'shallot, sliced': '1', 'fresh Thai or regular basil chopped': '1'}","['1. In a medium bowl, toss together the chicken, cornstarch, turmeric, ginger, and black pepper.', '2. In a glass jar, combine the honey, soy sauce, rice vinegar, fish sauce (if using) and 1/4 cup water.', '3. Heat the oil in a large skillet over medium-high heat. Add the bell peppers, jalapeños, and shallots, cook 2-3 minutes, until the peppers are charring. Stir in the chicken, tossing to combine with the peppers, cook 2 minutes.', '4. Pour in the honey/soy sauce mix. Bring the sauce to a boil over medium-high heat and cook until the sauce coats the chicken, about 8-10 minutes. Remove from the heat and stir in the basil.', '5. Serve the chicken and sauce over bowls of coconut lemongrass rice (recipe in notes). Top with plenty of fresh basil.']",335 kcal,6,https://www.halfbakedharvest.com/wp-content/uploads/2021/08/25-Minute-Black-Pepper-Jalapeño-Basil-Chicken-Stir-Fry-1-700x1050.jpg
